{
  "manifest_version": 2, "schema_version": 1, "id": "cftc-cot-coffee-c",
  "dataset_id": "cftc.disaggregated-cot-futures-only", "series_id": "coffee.managed-money-positioning",
  "series": "CFTC Disaggregated COT — ICE Coffee C managed-money and producer positioning",
  "satisfies": ["coffee-managed-money-positioning"], "subjects": ["COFFEE"], "provider": "CFTC",
  "authority_class": "government_official", "provider_priority": 100, "acquisition": "official_api",
  "source_type": "official_data", "tier": 5, "license": "public_domain",
  "licensing": {"access":"public","use":"allowed","redistribution":"allowed","terms_url":"https://publicreporting.cftc.gov/"},
  "host_allowlist": ["publicreporting.cftc.gov"], "credential_env": [],
  "release": {"cadence":"weekly","timezone":"America/New_York","expected_lag_days":3,"grace_days":9,"revision_policy":"revisable"},
  "entry": "fetch.py", "verify": "fetch.py --verify",
  "output_path": "data/<SUBJECT>/external/cftc/cot_coffee_c_<as_of>.json",
  "output_schema": {"series":"string","as_of":"date","contract":"string","contract_code":"string","observations":[{"date":"date","open_interest":"int","managed_money_long":"int","managed_money_short":"int","managed_money_net":"int","producer_long":"int","producer_short":"int","producer_net":"int"}],"source_url":"string"},
  "units": {"observations[].open_interest":"contracts","observations[].managed_money_long":"contracts","observations[].managed_money_short":"contracts","observations[].managed_money_net":"contracts","observations[].producer_long":"contracts","observations[].producer_short":"contracts","observations[].producer_net":"contracts"},
  "minimum_history": {"observations":150,"path":"observations"}
}
